105775371,355,데일리 필로소피,"라이언 홀리데이, 스티븐 핸슬먼 저/장원철 역",다산초당,2021-12-24,18000,16200,인문,철학/사상,,,"*전 세계 100만 부 돌파!* *[아마존], [월스트리트저널] 베스트셀러 1위**작가 팀 페리스, 트위터 CEO 잭 도시 등 ‘실리콘밸리의 철학멘토’*“매일 아침, 철학 한 문장을 읽는 건하루를 바꾸는 가장 간단한 방법이다!” 『타이탄의 도구들』 팀 페리스, 트위터 CEO 잭 도시의 철학 멘토 라이언 홀리데이 최고의 역작. 『에고라는 적』, 『스토아 수업』 등 철학과 자기계발을 접목하여 발간되는 책마다 독자들의 큰 사랑을 받은 라이언 홀리데이와 하버드대학교에서 철학으로 석사 학위를 받은 스티븐 핸슬먼이 하루를 바꿀 가장 쓸모 있는 철학의 세계로 우리를 초대한다. 이미 전 세계 28개국에서 100만 부 이상 판매되었고 [아마존]과 [월스트리트저널] 베스트셀러로 굳건히 자리매김한 이 책은 마르쿠스 아우렐리우스 황제부터 고대 사상가 세네카, 노예 출신의 철학자 에픽테토스 등 스토아 철학을 대표하는 철학자들의 생생한 메시지를 하루 한 장씩 읽을 수 있도록 구성되었다. 시대를 초월해 여전히 우리에게 강력한 울림을 주는 이들의 격언과 함께 라이언 홀리데이 특유의 명징하고 친근한 해설이 더해져, 누구나 자기 삶에 이들의 지혜를 적용할 수 있다. 당신의 일상에 이 철학을 직접 적용해야 하는 이유는 간단하다. 더욱 나은 삶을 살아갈 길을 제시하기 때문이다. ‘삶의 목적은 무엇이고 우리는 어떻게 살아야 할까?’ 인생의 고비에 부닥칠 때마다 우리는 자신에게 질문을 던지지만, 확실한 답을 찾기가 쉽지 않다. 2천 년 전, 스토아 철학자들은 삶의 여정 곳곳에서 맞닥뜨리는 질문에 대한 답을 우리가 살아가는 일상에서 찾았다. 그래서 이 철학은 깜짝 놀랄 만큼 현대적이며 실용적이다. 세네카의 말을 빌리면 “철학은 답을 내놓을 수 있어야” 한다. 당신이 마주한 문제들의 답을 찾는다는 단 하나의 목적을 위해, 이 책은 쓰였다."
176008,356,샬롯의 거미줄,엘윈 브룩스 화이트 저/가스 윌리엄즈 그림/김화곤 역,시공주니어,2000-12-31,13000,11700,어린이,3-4학년,어린이,5-6학년,"뉴베리 아너 상 수상작편견을 넘어선 윌버와 샬롯의 빛나는 우정『샬롯의 거미줄』은 작은 시골 농장에서 태어난 아기 돼지 윌버와 거미 샬롯을 비롯한 동물들을 주인공으로 한 이야기입니다. 거대한 스케일도 기상천외한 모험도 없는 이 이야기가 수많은 독자들에게 잊을 수 없는 작품으로 일컬어지는 이유는 돼지는 더럽다는, 거미는 징그럽다는 편견을 넘어서 주인공 윌버와 샬롯이 그 누구보다 값지고 빛나는 우정을 보여 주고 있기 때문입니다.날 때부터 가장 작은 무녀리 돼지로 태어나, 보잘것없고 더러운 존재라고 무시당하던 돼지 윌버와 잔인하고 피에 굶주려 보이는 거미 샬롯은 친구가 됩니다. 샬롯은 크리스마스 햄이 될 위기에 처한 윌버를 구하기 위해 ‘근사한 돼지’, ‘눈부신 돼지’, ‘겸허하기까지 한 돼지’로 윌버를 새롭게 명명합니다. 윌버는 그 덕분에 목숨을 구하고, 또한 자신이 얼마나 소중한 존재인지를 배워 갑니다.“왜 나에게 그렇게 잘해 주었니? 난 그럴 만한 자격이 없는데. 난 너에게 아무것도 해 준 게 없어.”(...) “너는 내 친구였어. 그것만으로도 굉장한 일이야.(...)” _본문 중에서아무런 편견 없이 외로운 누군가의 친구가 되어 주고, 친구이기 때문에 그를 이해하려 애쓰고, 어떤 대가도 바라지 않고 친구를 도와주는 것. 윌버와 샬롯의 우정은 각박한 현실을 살고 있는 모든 현대인에게 따뜻한 위로와 감동을 선사합니다."
6111280,357,불안,알랭 드 보통 저/정영목 역,은행나무,2011-12-28,15000,13500,에세이,삶의 자세와 지혜,에세이,외국 에세이,"'불안'은 하루에도 몇 번씩 경험하는, 현대를 사는 우리에게는 매우 밀접한 개념이다. 알랭 드 보통의 말대로, 우리의 삶은 불안을 떨쳐내고, 새로운 불안을 맞아들이고, 또 다시 그것을 떨쳐내는 과정의 연속인지도 모른다. 『불안』은 우리가 일상 속에서 겪는 다양한 종류의 불안 중 사회적 지위(status)와 관련된 불안을 집중적으로 탐구하고 있다.경제적 성취 정도에 의해, 즉 돈을 얼마나 벌었느냐에 따라 자연스럽게 지위가 구분되기 시작한 시기가 있었다. 그 시점부터 인간은 새로운 불안의 영역에 들어서게 된다. 여기에서 중요한 것은 '내가 나를 어떻게 보느냐'가 아니라, '세상이 나를 어떻게 보느냐'다. 저자는 세상의 눈으로 본 자신의 가치나 중요성에 의해 불안이 촉발되는 것으로 보았다.알랭 드 보통은 그 불안이 생기는 원인을 총 다섯 가지로 분류한다 - 사랑결핍, 속물근성, 기대, 능력주의, 불확실성. 또 여기에 철학, 예술, 정치, 기독교, 보헤미아 등 알랭 드 보통이 연구한 불안 해소의 해법이 더해진다. 저자는 이 책에서 2000여 년의 역사를 지탱해온 철학, 문학, 종교, 예술 등 방대한 자료를 훑으며 경제적 능력에서 비롯된 사회적 지위로 인한 불안, 그 처음과 끝을 파고 든다."
115323071,358,부의 삼각형,그릿 권은진 저,북스고,2022-11-17,20000,18000,경제 경영,투자/재테크,경제 경영,투자/재테크,"유튜브 리치맘 라이프의 상위 1%를 만드는 부자 시스템- 경제적 자유를 만드는 3단계 프로세스 - 예전이나 지금이나 아마 미래에도 사람들은 부자가 되고 싶어 한다. 그래서 많은 사람들과 미디어에서는 부자들의 습관과 투자 노하우 또는 그들이 먹고 마시고 입는 것까지 알려주기도 한다. 지금의 시대 부자가 되기 위한 도전에 머뭇거릴지언정 돈을 버는 방법을 몰라서 하지 못하는 것은 아니다. 그만큼 돈 버는 방법, 부자가 되기 위한 세상의 거의 모든 방법을 이미 많은 사람들이 알고 있지 않을까?이 책의 저자는 원래 직업선호도 1위의 ‘교사’였다. 하지만 결혼과 출산, 육아를 하면서 현재의 삶을 돌아봤을 때 소위 ‘벼락거지’ ‘흙수저’일 뿐이라는 ‘현타’를 느꼈다. 그 덕에 마이너스 통장 5,000만원에서 시작하여 순자산 20억을 만들었다. 물론 50억, 100억의 슈퍼리치들의 이야기가 굉장히 자극적이고 많은 사람들의 눈길을 끈다. 하지만 실제 투자를 입문하고 주식으로 돈을 잃지 않고 벌기 위해서는 ‘나’와 비슷한 처지에서 시작하여 현실에서 구르고 구른 사람의 조언이 더 와 닿지 않을까? 이 책의 저자처럼 말이다. [부의 삼각형]은 부자가 되기 위해, 경제적 자유를 얻기 위해, 행복을 위해 부자가 되기로 결심한 저자가 부동산, 미국 주식, 국내 주식으로 돈을 번 방법을 모두 다루고 있다. 가장 평범한 삶을 살았기에 단순하고 리스크를 최대한 적게 가지고 갈 수 있는 투자를 선택할 수밖에 없었던 저자의 투자 이야기다. 제1장에서는 더 이상 투자를 미루면 안 되는 이유를 사례로 설명하고 투자에 대한 동기부여를 제시한다. 제2장에서는 부자 비법을 구체적으로 설명하며 부자 로드맵과 세부 계획, 실행의 성공에 대해 다룬다. 제3장, 제4장, 제5장에서는 이 책에서 저자가 이야기하고 있는 부의 삼각형인 부동산, 미국 주식, 국내 주식의 실전 투자 방법을 다루며 이 책을 읽는 누구라도 성공할 수 있도록 이끈다. 마지막 제6장에서는 평생 부자로 사는 인생을 위해 부자의 마인드와 흔들리지 않는 멘탈에 대해 다루고 있다. 리스크 없는 투자란 없지만, 그럼에도 불구하고, 현명한 투자자의 삶, 자본가의 삶을 살 수 있는 가이드이자 입문서가 되길 바란다."
103616546,359,오늘부터 배프! 베프!,지안 글/김성라 그림,문학동네,2021-09-08,10000,9000,어린이,3-4학년,어린이,어린이 문학,"[문학동네어린이문학상 대상 수상작] 급식카드를 처음 사용하게 된 아이의 모습을 섬세하게, 아이가 느끼는 다양한 감정의 결을 씩씩한 문장으로 그려냈습니다. 둘에서 셋, 셋에서 넷으로 베스트 프렌드 '베프'와 배고플 때 함께 맛있는 거 나눠 먹는 프렌드 '배프'가 늘어 가고 연대하는 과정이 무척 따뜻하게 다가옵니다. - 어린이MD 김현기                                                    『긴긴밤』 『5번 레인』의 감동을 잇는 제22회 문학동네어린이문학상 대상 수상작!체크카드를 사용하는 유림이, 체크카드를 갖고 싶었지만 급식카드를 갖게 된 서진이, 이미 오래전부터 급식카드를 사용하고 있는 소리와, 소리가 돌보는 아기 고양이의 며칠간을 그린 『오늘부터 배프! 베프!』는 “인물을 대하는 작가의 태도가 신중하고 따뜻한 작품이다. 모든 면에서 동화의 전범이라 할 만한 플롯을 보여 준다. 어린이는 밥만으로 사는 게 아니다. 너무 당연하지만 너무 자주 잊게 되는 이 사실을 아동급식카드라는 시의적인 소재로 새롭고 정확하게 풀어냈다.”는 평을 받으며 제22회 문학동네어린이문학상 대상을 수상했다.서진이가 조금 더 자유롭게 밥을 먹었으면 하는 소망에서 시작된 이 이야기는, 급식카드를 처음 사용하게 된 아이의 모습을 애정 어린 눈으로 섬세하게 그리되, ‘가난’이라는 틀 안에 아이를 가두지 않고, 학교에서 집에서, 가족 속에서 친구들 사이에서 아이가 느끼는 다양한 감정의 결을 씩씩한 문장으로 그려냈다. 친구에게 맛있는 걸 사 주고 싶은 마음, 나보다 다른 친구와 더 친한 거 같아 꼬깃꼬깃한 마음, 처음엔 별로였지만 의외의 모습을 보며 점점 그 친구가 궁금해지는 마음, 엄마한테 가끔은 화도 나지만 좋은 기분은 나누고 싶은 마음, 내 맘을 몰라주는 어른들한테 화나는 마음, 급식카드 때문에 마음 졸이고 싶지 않은 마음…… “현실의 문제점을 고발하기 위해 인물과 상황을 소비하지 않고, 아이 마음을 내시경으로 들여다보며 한 땀, 한 땀 바느질하듯 써 내려갔기에” 이 작품은 더욱 빛이 난다. 둘에서 셋, 셋에서 넷으로 베스트 프렌드 ‘베프’와 배고플 때 함께 밥 먹는 프렌드 ‘배프’가 늘어 가는 모습이 따듯하다."
114848694,360,인생의 역사,신형철 저,난다,2022-10-31,18000,16200,에세이,한국 에세이,,,"[우리의 삶이 한 편의 시와 같다면] 시를 읽는 일은 인생을 읽는 일, 『인생의 역사』는 시로 다시 겪게 되는 생의 순간, 걷게 되는 사색의 걸음을 담는다. “나는 인생의 육성이라는 게 있다면 그게 곧 시라고 믿고 있다.” 말하는 평론가 신형철은 스물다섯 편의 시를 소개하며 그 행과 연 사이를 흐르는 운율에서 삶을 읽어낸다. -에세이 PD 박형욱                                    “나는 인생의 육성이라는 게 있다면그게 곧 시라고 믿고 있다.”4년 만에 선보이는 평론가 신형철의 신작* 『인생의 역사』 초판 한정으로 출고된 양장본은 현재 소진되어, 2쇄부터 무선본으로 출고되오니 도서 구입시 참고 부탁드립니다.우리 문학을 향한 ‘정확한 사랑’이자 시대를 읽는 탁월한 문장, 평론가 신형철이 4년 만의 신작으로 돌아왔다. 다섯번째 책이자 처음으로 선보이는 ‘시화(詩話)’임에 그 제목을 『인생의 역사』라 달았다. 저자 스스로 ‘거창한 제목’이라 말하지만, 그 머리에 ‘인생’과 ‘역사’가 나란한 까닭은 간명하다. 시를 이루는 행(行)과 연(聯), 걸어가면서 쌓여가는 일. 우리네 인생이, 삶들의 역사가 그러한 것처럼.총 5부에 걸쳐 동서고금 스물다섯 편의 시를 꼽아 실었다. 상고시가인 「공무도하가」부터 이영광 시인의 「사랑의 발명」까지, 역사의 너비와 깊이를 한데 아우르는 시들이다. 시 한 편마다 하나의 인생이 담겼음에, 이를 풀어 ‘알자’ 하는 대신 다시 ‘겪자’ 하는 저자의 산문을 나란히 더했다. 여기에 부록으로 묶은 다섯 편의 글은 시의 안팎을 보다 자유로이 오가며 써낸 기록이다.시를 함께 읽고자 함이나 그 독법을 가르치는 글은 아니다. 직접 겪은 삶을 시로 받아들이는 일, 그리하여 시를 통해 인생을 살아내는 이야기라 하겠다. 저자의 말대로 시를 읽는 일은 “아는 것이 아니라 겪는 것”일 터이므로. ‘시’는 그다지 대단하지 않은 대단한 예술이다. 시는 행(行)과 연(聯)으로 이루어진다. 걸어갈 행, 이어질 연. 글자들이 옆으로 걸어가면서(行) 아래로 쌓여가는(聯) 일이 뭐 그리 대단할 게 있겠는가. 그런데 나는 인생의 육성이라는 게 있다면 그게 곧 시라고 믿고 있다. 걸어가면서 쌓여가는 건 인생이기도 하니까. 그런 의미에서 인생도 행과 연으로 이루어지니까. (7쪽)"
65925807,361,스프링북 어린이 스도쿠 1,브레이니 퍼즐 랩 글그림,시간과공간사,2018-11-01,7700,6930,어린이,1-2학년,어린이,3-4학년,어린이의 눈높이에 맞춘 스프링북 어린이 스도쿠!하나씩 풀다 보면 논리력 / 집중력 / 추리력 강화!스도쿠는 영국 공교육 교재로 사용될 만큼 논리력 증진에 도움이 되는 게임이고 수학자 트레버 호크스는 “스도쿠는 뇌에 자극을 주는 논리 게임으로 어린이 두뇌 발달에 도움을 준다”라고 말했습니다.하.지.만. 오직 어린이들을 위해 만들어진 스도쿠는 찾기 힘들어요.그.래.서. 미취학 아동 및 초등학교 저학년부터 고학년까지 풀 수 있는 어린이 맞춤형 스도쿠를 만들었습니다.
68724647,362,경매 권리분석 이렇게 쉬웠어?,박희철(파이팅팔콘) 저/송희창(송사무장) 감수,지혜로,2019-01-15,18000,16200,경제 경영,투자/재테크,,,"권리분석이 어렵다고??실전 투자자가 알려주는 가장 쉽고, 가장 체계적인 초간단 권리분석법!이제 초보도 권리분석을 쉽게 정복하고, 쉽게 수익낼 수 있다.대부분의 초보들이 권리분석 공부가 어려워 경매 투자를 중도 포기하는데, 그것은 권리분석이 어려워서가 아니라 어렵게 공부하기 때문이다. 책의 저자는 그동안 자신이 직접 투자했던 물건을 바탕으로, 실수하지 않고 쉽게 권리분석하는 방법과 쉬운 물건만으로도 부를 쌓은 자신의 노하우를 진하게 담아냈다.경매 투자로 성공하려면 공부단계에서 멈추지 않고 첫 수익을 맛봐야만 한다. 실제 수익을 경험하기 위해서 공부는 쉽고 재밌게 해야 하는 것이다. 이 책을 정복한다면 당신은 고수익의 경매 투자의 길로 나아갈 수 있다."
4248412,363,차트박사의 승률 80% 신 매매기법,성경호 저,이레미디어,2010-10-20,35000,31500,경제 경영,투자/재테크,경제 경영,투자/재테크,"2005년 키움닷컴증권 주식영웅전 실전수익률게임 전체 1위 우승, 2006년 키움닷컴증권과 팍스넷 공동주최 실전수익률게임 주식제왕전 수익금 1위 우승에 빛나는 저자의 매매기법을 담은 책이다. 이 책은 저자가 7년간의 주식투자를 하면서 실패에 실패를 거듭한 끝에3년 넘게 실전에 적용하면서 연구한 각고의 노력 끝에 나온 노하우와 신 매매 기법들을 다루고 있다. 실전에서 검증된 투자 방법을 제시하여, 주식시장에서 수익을 내기 어려운 일반투자가들에게 승률을 올릴 수 있도록 안내해 준다."
34705576,364,수레바퀴 아래서 : 오리지널 초판본 표지디자인,헤르만 헤세 저,코너스톤(도서),2017-01-01,7500,3300,소설/시/희곡,독일소설,,,"강압적인 교육과정과 편협한 어른들이 주는 부담 속에파괴되어 가는 어린 영혼의 소리 없는 절규!1906년 오리지널 초판본 표지로 만나는 『수레바퀴 아래서』!성적 위주의 교육 속에서 경쟁에 지쳐 자신을 잃어버린 모든 이들에게 공감과 위로를 전하는 『수레바퀴 아래서』는 헤르만 헤세 자신의 청소년기를 반영한 자전적 소설이다. 이제 『수레바퀴 아래서』를 1906년 오리지널 초판본 표지로 소장해보자!총명한 소년 한스는 주위 어른들의 기대에 부응하기 위해 어려운 신학교 입학시험 공부에 매진한다. 좋은 성적으로 시험을 통과한 한스는 신학교에서 감수성이 예민하고 활동적인 하일너를 만나 우정을 나누지만 그만큼 공부에 흥미를 잃어가고, 교사들은 이런 두 사람을 더욱 엄격하게 관리한다. 이에 반항해 신학교를 무단이탈한 하일너는 결국 퇴학당하고, 홀로 남은 한스는 성적에 대한 스트레스와 교사들의 질타, 친구들의 무관심을 견디지 못하고 신학교를 떠나는데…."
93780644,365,라면을 먹으면 숲이 사라져,최원형 글/이시누 그림,책읽는곰,2020-10-23,13000,11700,어린이,3-4학년,어린이,5-6학년,"“지구에 존재하는 모든 생명은 아주 가깝게 이어져 있어!”우리와 연결된 세상의 끈을 알려 주는 환경 책우리가 사는 이 세상은 서로서로 연결되어 있습니다. 오늘 우리가 한 사소한 행동 하나가 내일 다른 생물이나 환경에 엄청난 영향을 끼치기도 하지요. 『라면을 먹으면 숲이 사라져』는 오늘 내가 입은 옷, 오늘 내가 먹은 라면, 오늘 내가 즐긴 돌고래 쇼가 다른 생물과 환경에 어떤 영향을 끼치는지 보여 주는 책입니다."
12591797,366,불안의 서,페르난두 페소아 저/배수아 역,봄날의책,2014-03-27,28000,25200,에세이,외국 에세이,,,"“페르난두 페소아, 한번이라도 그의 글을 읽었던 사람은 그 이름을 잊지 못한다.”  이 책은 소아레스를 둘러싸고는 있으나 그의 내면으로는 침투해 들어오지 못하는 세계, 그리고 보조회계원으로서의 피상적 일상을 상세하게 관찰하고 관조적으로 기술한 외면이자 내면의 일기다. 때로는 길고 때로는 극히 짧은 메모와 회고, 인상, 사색과 명상 그리고 환상을 기록한 언어는 시적인 은유로 가득하다. 일기는 삶의 의미와 인간의 운명, 그리고 영혼의 비밀을 묻는 비탄의 노래처럼 들린다. 리스본의 장소들, 리스본의 풍경들이 많은 경우 그의 관찰과 관조의 대상이 된다. 대표적으로 금 세공사들의 거리인 도라도레스는 소아레스가 사는 곳이면서 동시에 전세계이자 삶 전체를 상징한다.수많은 파편적 텍스트, 스케치들과 아포리즘이 그 어떤 줄거리도 구성하지 않은 채, 오직 의식의 연상을 따라 진행되는 이 책은 열린 형식의 현대적 작품이다. 소아레스-페소아가 세계를 바라보는 시선과 명상 그리고 성찰에는 인류의 보편성과 한 개인의 특성이 모두 반영되는데, 인간이란 무엇인가, 삶의 의미는 무엇인가, 그리고 자아의 비밀에 대한 질문이 책 전체를 관통하는 주된 테마를 이룬다.리스본은 대양에 접한, 꿈과 그리움이 조우하는 흰빛의 도시다. 페르난두 페소아보다 더욱 뛰어나게 리스본의 멜랑콜리와 고독을 감지한 작가는 없었다. 그는 항상 새로운 가면을 쓰고 리스본의 좁은 골목길을 배회한다. 세계라는 거대한 무대에서 벌어지는 연극을 매 순간 시선으로 포착하기 위해서. 《불안의 서》는 요약되거나 분류되기를 거부하는, 지상에서 가장 슬픈 책이다. 소설가 배수아의 완역본."
76185005,367,종의 기원,"찰스 로버트 다윈 저/장대익 역/최재천, 강호정, 김성한 기획 외 3명
                    
정보 더 보기/감추기



찰스 로버트 다윈
장대익
최재천
강호정
김성한
전중환
주일우
최정규",사이언스북스,2019-07-31,22000,19800,자연과학,생명과학,자연과학,과학,"『종의 기원』 출간 160년드디어 다윈을 제대로 읽을 수 있는 시대가 되었다!다윈 사상의 출발점이라 할 『종의 기원』 초판을 진화 생물학자가 번역한 한국 출판사상 최초의 우리말 정본(定本). 장대익 서울대 교수가 번역하고 최재천 이화여대 에코 과학부 교수가 이끈 다윈 포럼이 기획하고 감수한 한국 진화 생물학계의 역량을 결집한 최초의 다윈 선집. 「드디어 다윈」 시리즈 그 첫 번째 책. 인류 역사상 가장 위대한 아이디어, 자연 선택을 통한 진화, 그 장엄한 사상의 조용한 탄생을 목격할 수 있는 『종의 기원』 초판."
8949343,368,기브 앤 테이크,애덤 그랜트 저/윤태준 역,생각연구소,2013-06-07,17500,15750,자기계발,처세술/삶의 자세,자기계발,인간관계,"양보하고, 배려하고, 베풀고, 희생하고, 조건 없이 주는 사람이어떻게 성공 사다리의 꼭대기에 올랐을까?[포천]이 선정한 세계 최고의 인맥을 쌓은 사람은 누구이며, 그 비결은 무엇인가? 말더듬이 신참 변호사가 어떻게 재판에서 청산유수 베테랑 변호사를 이겼을까? 미국 역사상 가장 위대한 대통령의 인사 시스템에는 어떤 비밀이 숨어 있는가? 베풂을 좌우명으로 삶고 사는 사람이 세계적인 부자가 될 수 있었던 까닭은?통념에 따르면 탁월한 성공을 거둔 사람에게는 세 가지 공통점이 있다. 바로 타고난 재능과 피나는 노력, 결정적인 타이밍이 그것이다. 세계 3대 경영대학원 와튼스쿨에서 역대 최연소 종신교수에 임명된 조직심리학자, 애덤 그랜트는 이 책에서 대단히 중요하지만 흔히 간과하는 성공의 네 번째 요소를 ‘타인과의 상호작용’으로 규정한다. 그리고 주는 것보다 더 많은 이익을 챙기려는 사람(테이커, taker)이나 받는 만큼 주는 사람(매처, matcher)보다 ‘자신의 이익보다 다른 사람을 먼저 생각하는 사람(기버, giver)’이 더 성공할 가능성이 높다는 혁명적인 가설을 내놓는다.이 책은 우리 사회를 지배해온 성공에 대한 고정관념, 즉 강하고 독한 자가 모든 것을 가져간다는 ‘승자 독식’의 근본 명제를 뒤집는다. 또 착한 사람은 이용만 당할 뿐 성공하기 어렵다는 불문율을 깨뜨리며 ‘바쁜 와중에도 누군가를 돕고, 지식과 정보를 기꺼이 공유하며, 남을 위해 자신의 이익을 양보하는’ 사람, 즉 기버가 성공 사다리의 맨 꼭대기를 차지한다는 사실을 놀랄 만큼 방대한 사례와 입체적인 분석, 빈틈없는 논리를 통해 체계적으로 입증한다."
89828801,369,할머니의 용궁 여행,권민조 글그림,천개의바람,2020-04-07,12000,10800,유아,4-6세,유아,유아 그림책,"아윤이의 할머니는 경상도 바닷가 마을의 해녀예요. 할머니가 물질하러 바다로 나가면 아윤이는 집에서 할머니를 기다리지요. 그러던 어느 날, 할머니가 늦게까지 돌아오지 않자 아윤이는 할머니가 걱정되어 바닷가로 갑니다. 막 뭍으로 나온 할머니는 바닷속에서 엄청난 일을 겪었다며 재미난 이야기를 들려주었지요.평소처럼 미역 밭 가꾸러 바다로 들어간 할머니는 엄청 큰 전복이 무더기로 있는 걸 발견하고망사리 째로 쓸어 담고 있었지요. 그때 할머니 앞에 넓적한 광어가 나타나서는 자기 좀 살려 달라고 애원했어요. 평소 어려운 사람을 모른척하지 않는 할머니는 광어를 도와주겠다고 해요. 광어가 할머니 주위를 뱅뱅 돌자 할머니는 납작해지고 아가미도 생기더니 바위틈으로 들어가게 되지요. 물이 뜨끈했다가 차가웠다가 늘어났다 줄어들었다 백여덟 번 될 때쯤 지나자, 할머니는 으리으리한 용궁에 도착해요. 그런데 들어가자마자 바다 동물들이 할머니 무릎을 꿇리더니 용왕인 거북이 아프다며 할머니에게 간을 달라는 거예요. 무슨 소리를 하냐며 불같이 화를 내던 할머니는 용왕 거북의 얼굴을 보고 너무 불쌍해서 할말을 잃어요. 도대체 바다동물들에게 무슨 일이 일어난 걸까요? 할머니는 이 위기를 넘기고 무사히 집으로 돌아올 수 있을까요?"
119275854,370,미래엔 중학교 국어 2-1 자습서+평가문제집 (전2권),신유식,미래엔,2018-12-01,36000,32400,전집,청소년/일반,전집,학습,
