107666677,242,부의 인문학 (20만부 기념 개정증보판),브라운스톤(우석) 저,오픈마인드,2022-03-21,17000,15300,경제 경영,CEO/비즈니스맨,,,"2년 만에 20만 부를 넘어선 특급 베스트셀러!더 깊어진 생각, 더 풍부해진 경험으로 완성한 개정 증보판!책속에서 찾아낸 투자 인문학의 연금술우석은 무엇보다 독서에 열정적이며 책에서 배운 지식을 지혜의 틀로 걸러 ‘자본주의 게임에서 승리하는 법’을 터득한 성공한 투자가다. 철학자들의 통찰을 통해 나만의 투자 무기를 얻을 수 있게 이끄는가 하면, 노벨 경제학상 수상자들의 이론을 바탕으로 한국 시장을 이해하고 자신감 있게 투자할 수 있도록 격려한다. 부동산도 주식도 결국 자본주의 게임의 트랙 위에 있음을 깨닫게 해준다. 성공한 실전 투자가가 현장 경험으로 필터링한 인문학은 철학이나 경제학에 문외한인 사람도 거인의 눈으로 시장을 바라볼 수 있도록 이끈다. 거인의 어깨 위에서 보는 돈이 움직이는 길네이버 카페 ‘부동산 스터디’의 최고 인기 논객인 우석이 올린 예측 글은 ‘예언’으로 통한다. ‘성지순례’ 오는 180만 회원들이 그의 프로필을 대변한다. 하지만 그는 자신의 전망이 개인적인 경험이나 생각에서만 나온 것은 아니라고 말한다. 자신의 전망이 마치 예언처럼 딱딱 들어맞는 것은 자신이 ‘거인의 어깨’ 위에 올라앉아서 돈이 움직이는 길을 바라보고 있기 때문이라는 설명이다. 200년 전 경제학 이론이 오늘의 세계를 너무도 정확히 설명하고 있음을 확인하는 순간 “역시 우석은 우석이다!” 저절로 고개를 끄덕이게 된다. 노벨 경제학상을 수상한 천재들이 세상을 읽는 탁월한 통찰력, 돈이 움직이는 방향과 투자의 길, 부의 작동원리를 간파한 통섭의 결정판이다.성공한 한국형 투자가의 경험과 지혜그는 한국 투자시장에서 성공의 길을 개척한 실전 투자가다. 신혼집 전세금으로 시작한 투자에서 롤러코스터도 여러 번 탔다. 하지만 부의 작동원리를 터득한 뒤 인생을 즐기기에 충분한 부를 달성했고, 오랫동안 꿈꾸던 자유를 찾아 40대 초반에 은퇴했다. 물론 그 뒤로도 그의 자산은 꾸준히 늘어나고 있고, 그만큼 실전 투자 경험도 축적되면서 안팎으로 탄탄한 투자가로서의 입지를 굳히고 있다. 이 책은 수익률로 검증된 경험과 지혜를 솔직 담백한 화법으로 담아 투자 인문학의 새 지평을 열었다. 격동하는 한국 투자시장에서 살아남은 투자가의 거친 숨소리가 고스란히 담겨 있어, 바로 오늘 투자 시장에서 고투하고 있는 당신에게 길을 알려주는 등대가 될 것이다."
108422348,243,채식주의자,한강 저,창비,2022-03-28,15000,13500,소설/시/희곡,한국소설,,,"인터내셔널 부커상, 산클레멘테 문학상 수상작전세계가 주목한 한강의 역작을 다시 만나다 2016년 인터내셔널 부커상을 수상하며 한국문학의 입지를 한단계 확장시킨 한강의 장편소설 『채식주의자』를 15년 만에 새로운 장정으로 선보인다. 상처받은 영혼의 고통과 식물적 상상력의 강렬한 결합을 정교한 구성과 흡인력 있는 문체로 보여주는 이 작품은 섬뜩한 아름다움의 미학을 한강만의 방식으로 완성한 역작이다. “탄탄하고 정교하며 충격적인 작품으로, 독자들의 마음에 그리고 아마도 그들의 꿈에 오래도록 머물 것이다”라는 평을 받으며 인터내셔널 부커상을 수상했던 『채식주의자』는 “미국 문학계에 파문을 일으키면서도 독자들과 공명할 것으로 보인다”(뉴욕타임스), “놀라울 정도로 아름다운 산문과 믿을 수 없을 만큼 폭력적인 내용의 조합이 충격적이다”(가디언)라는 해외서평을 받았고 2018년에는 스페인에서 산클레멘테 문학상을 받는 등 전세계에서 뜨거운 반응을 일으켰다. 국내에서는 현재까지 100만부 가까이 판매되었다. 『채식주의자』는 어느 날부터 육식을 거부하며 가족들과 갈등을 빚기 시작하는 ‘영혜’가 중심인물로 등장하는 장편소설이다. 하지만 소설은 영혜를 둘러싼 세 인물인 남편, 형부, 언니의 시선에서 서술되며 영혜는 단 한번도 주도적인 화자의 위치를 얻지 못한다. 가족의 이름으로 자행되는 가부장의 폭력, 그리고 그 폭력에 저항하며 금식을 통해 동물성을 벗어던지고 나무가 되고자 한 영혜가 보여주는 식물적 상상력의 경지는 모든 세대 독자를 아우르며 더 크나큰 공명을 이루어낼 것이다."
117661785,244,설민석의 한국사 대모험 24,"설민석, 스토리박스 글/정현희 그림/강석화 감수",단꿈아이,2023-02-27,13000,11700,어린이,1-2학년,어린이,3-4학년,"*누적 판매 500만 부 돌파!*초등학습만화 시리즈 베스트셀러!*현직 초등 교사의 강력 추천!우리 아이 한국사 첫걸음, [설민석의 한국사 대모험]으로 시작하세요!2017년 1권이 처음 출간된 이래, 누적 판매 부수 500만 부라는 경이적인 수치를 기록하며 대한민국 대표 어린이 역사책으로 굳건히 자리매김한 [설민석의 한국사 대모험]! [설민석의 한국사 대모험]은 아이들이 처음 접하는 한국사를 재미있는 만화와 깊이 있는 부록으로 쉽고, 재미있고, 유익하게 전달합니다. 이 책은 우리 아이들이 놀이하듯 즐겁게 한국사를 접하며 한국사에 관심을 가지고, 나아가 한국사를 사랑하는 어린이로 성장하게 도와줄 것입니다. [설민석의 한국사 대모험] 24권에서는 병자호란의 결과와 이후의 이야기를 재미있는 만화로 담아냈습니다. 전쟁이 어떻게 끝을 맺고 어떤 결과를 가져왔는지 [설민석의 한국사 대모험] 24권에서 확인해 보세요!"
7564383,245,사람이 보인다 관상백과,편집부 저,움터미디어,2012-09-15,6000,2200,종교,역학/사주,,,"관상은 유전적 요소와 환경에서 오는 마음의 상태를 확실하게 나타내 보인다, 따라서 관상을 볼 줄 알면, 먼저 자기 자신도 알고, 다음에 상대방을 알 수 있기 때문에 대인 관계도 원활히 할 수 있다. 흔히 첫 인상이 좋다 왠지 마음에 안 든다 라는 말을 하는데 이것이 이미 관상을 보고 있는 것이다. 이미 관상가인 여러분은, 관상에 대해 좀 더 많은 것을 이 책을 통해 알아두면 장래의 인간관계가 더욱 향상될 것이다."
69294378,246,찰리와 초콜릿 공장,로알드 달 저/퀸틴 블레이크 그림/지혜연 역,시공주니어,2019-01-25,12000,10800,어린이,3-4학년,어린이,5-6학년,"전 세계 어린이들이 꿈꾸는 달콤한 행운!생동감 넘치는 표지, 재치 있는 언어로새롭게 문을 여는 『찰리와 초콜릿 공장』“넌 기분이 안 좋을 때 무엇이 위안이 되니?” -영화 『찰리와 초콜릿 공장』 중에서어린이들이 가장 좋아하는 작가로 손꼽히는 로알드 달. 그의 책은 어른들보다 어린이들이 먼저 찾는다는 점에서 특별합니다. 그런 인기의 비결은 무엇보다 대담한 상상력과 배꼽 잡는 유머에 있습니다. 어떤 상황에서도 웃음을 자아내며 모험을 펼치는 그의 이야기는 한번 잡은 책을 손에서 뗄 수 없게 하는 힘이 있습니다. 결과를 예측할 수 없는 이야기와 긴박한 전개 역시 로알드 달의 매력. “현재 동화 작가 중에서 가장 대담하고 신나고 뻔뻔한 책을 만든 작가”라는 평은 괜히 따라다니는 게 아닙니다. 어른들은 깜짝 놀라게 하고, 어린이들에게는 넘치는 사랑을 받는 책 중에서도 명작으로 손꼽히는 『찰리와 초콜릿 공장』은 1971년에 [초콜릿 천국]으로 처음 영화화됐고, 2005년에는 팀 버튼 감독이 제작을 맡아 조니 뎁 주연의 영화로 다시 태어나기도 했습니다.『찰리와 초콜릿 공장』은 세상에 단 다섯 장뿐인 황금빛 초대장을 찾은 어린이들이 소문만 무성한 초콜릿 공장을 견학하는 이야기로, 이제껏 본 적 없는 진기하고 기상천외한 일들이 긴장감 있게 펼쳐집니다. 기발한 상상력, 롤러코스터 같은 긴박한 사건, 개성 넘치는 캐릭터, 불합리한 폭력에 대항하는 비판과 응징, 그리고 움파룸파 사람들의 유머러스하고도 풍자 넘치는 노랫말까지! 로알드 달의 매력을 한껏 느낄 수 있는 작품입니다.국내에서 새롭게 개정된 『찰리와 초콜릿 공장』은 천재 초콜릿 발명가 윌리 웡카와 황금빛 초대장을 얻어 신난 찰리의 모습을 한눈에 볼 수 있는 재미있는 요소로 표지를 꾸몄습니다. 로알드 달 작품의 전문 번역가 지혜연은 작품 당시의 시대적 배경과 뒷이야기를 새롭게 담았습니다."
69724044,247,팩트풀니스,"한스 로슬링, 올라 로슬링, 안나 로슬링 뢴룬드 공저/이창신 역",김영사,2019-03-08,19800,17820,인문,인문/교양,사회 정치,사회비평/비판,"빌 게이츠가 미국 모든 대학 졸업생에게 직접 선물한 화제의 책강력한 사실을 바탕으로 세상을 정확하게 바라보는 방법을 담은 혁명적 저작전 세계적으로 확증편향이 기승을 부리는 탈진실의 시대에, 막연한 두려움과 편견을 이기는 팩트의 중요성을 일깨우는 세계적 역작! 세계를 이해하기 위한 13가지 문제에서 인간의 평균 정답률은 16%, 침팬지는 33%. 우리는 왜 침팬지를 이기지 못하는가? 똑똑하고 현명한 사람일수록 세상의 참모습을 정확히 알지 못한다! ‘느낌’을 ‘사실’로 인식하는 인간의 비합리적 본능 10가지를 밝히고, 우리의 착각과 달리 세상이 나날이 진보하고 있음을 명확한 데이터와 통계로 증명한 놀라운 통찰. 세상을 바라보는 방식을 바꾸고 미래의 위기와 기회에 대처하기 위해 반드시 읽어야 할 필독서이다.책은 출간과 동시에 세계 지성계를 사로잡으며 뜨거운 화제를 모았다. 버락 오바마 전 대통령은 반드시 읽어야 할 책 목록 5권 중에 하나로 추천했다. 스티븐 핑커 하버드대학 심리학과 교수는 풍부한 데이터를 통해 우리의 인지과정이 어떻게 우리를 잘못된 길로 이끌 수 있는지를 합리적으로 설명한 책으로, [네이처]는 읽는 것만으로도 우리의 세계관이 완전히 뒤바뀔 거라며 극찬했다. 또한 [옵저버]는 금세기 최고의 책으로 선정했고, [뉴욕타임스], [월스트리트저널], [가디언], [선데이타임스] 등 유수 언론의 베스트셀러에 오르며 출간 이후 6개월 만에 100만부를 돌파하는 기록을 세웠다.전 세계적으로 확증편향이 기승을 부리는 탈진실(post-truth)의 시대에, 『팩트풀니스』는 막연한 두려움과 편견을 이기는 팩트의 중요성을 일깨우는 역작이다. 빈곤, 교육, 환경, 에너지, 인구 등 다양한 영역에서 우리가 생각하는 세계와 실제 세계의 간극을 좁히고 선입견을 깨는 통찰을 제시한다. 우리의 편견과 달리 세상이 나날이 진보하고 있음을, 사실에 충실한 명확한 데이터와 통계로 이를 낱낱이 증명한다.빌 게이츠가 사회로 진출하는 청춘에게 이 책을 선물한 이유는, ‘세상은 나아지고 있다’는 긍정의 시각을 심어주는 동시에 자기 신념이 사실과 부합하는지 돌아보라는 충고이기도 할 것이다. 우물 안에 계속 갇혀 살기보다 올바르게 사는 데 관심이 있다면, 세계관을 흔쾌히 바꿀 마음이 있다면, 본능적 반응 대신 비판적 사고를 할 준비가 되었다면, 이 책을 반드시 읽어보기 바란다. 한국 사회가 나아갈 방향에도 중요한 이정표가 되어줄 것이다."
91766653,248,천 개의 파랑,천선란 저,허블,2020-08-19,14000,12600,소설/시/희곡,장르소설,소설/시/희곡,한국소설,"[모든 작은 존재들을 긍정하는 이야기] ‘우리는 모두 천천히 달리는 연습을 해야 한다.’ 작가는 이 문장이 『천 개의 파랑』의 시작이었다고 말한다. 한 방향으로 빠르게 빠르게만 달려온 이들에게 다른 길을 보여주는 이야기, 상처받고 흔들리면서도 단단하게 연결되어 서로를 지탱하는 존재 모두를 긍정하는 이 소설이 반갑고 고맙다. -소설MD 박형욱                                                    ‘한국과학문학상’의 또 다른 성취로 기억될 이름!우리 SF가 품게 된 가장 따뜻한 물결, 천선란!2019년 첫 장편소설 『무너진 다리』로 SF 팬들에게 눈도장을 찍었고, 2020년 7월, 소설집 『어떤 물질의 사랑』을 통해 우리 SF의 대세로 굳건히 자리 잡은 천선란. 2019년 한국과학문학상 장편 대상 수상작 『천 개의 파랑』은 이를 방증하듯 출간 전부터 많은 SF 팬들의 뜨거운 기대를 모았다. 『천 개의 파랑』은 한국과학문학상 심사위원 김보영에게 “천 개의 파랑이 가득한 듯한 환상적이고 우아한 소설”, “이미 활발하게 활동하고 있는 유명 작가의 작품이라 해도 믿을 법했다” 라는 찬사를 이끌어냈다. 이는 김창규 작가가 한국과학문학상 심사평에서 언급한 말과 맥을 같이 한다. “더 이상 좋은 한국 SF의 가능성’이란 얘기는 듣지 않아도 되겠다는 생각이 들어 기뻤다. 그만큼 SF를 충분히 소화하고 빚은 작품들이, 가능성을 넘어 다양한 길을 정하고 완성되고 있었다.” 천선란은 더 이상 SF의 가능성이 아니다. 그는 이미 완숙하게 무르익은 상태로 우리에게 도달한 ‘준비된 작가’다.SF가 진보하는 기술 속에서 변화하고 발전하는 모습을 예견하는 장르라면, 『천 개의 파랑』은 진보하는 기술 속에서 희미해지는 존재들을 올곧게 응시하는 소설이다. 발달한 기술이 배제하고 지나쳐버리는 이들, 엉망진창인 자본 시스템에서 소외된 이들, 부서지고 상처 입은 채 수면 아래로 가라앉아 있던 이들을 천선란은 다정함과 우아함으로 엮은 문장의 그물로 가볍게 건져 올린다. 그의 소설은 희미해진 이들에게 선명한 색을 덧입히는 과정으로 이루어져 있다. 『천 개의 파랑』은 천선란 작가가 휴대폰 메모장에 적어놓은 한 줄에서부터 시작한다. ‘우리는 모두 천천히 달리는 연습을 해야 한다.’ 빠른 속도로 지나가는 풍경 속에서도 ‘있는 힘껏 고개를 돌려 흐릿한 풀잎을 바라보는’ 천선란의 시선은 올곧으며, 개미 한 마리조차 밟지 않기 위해 느린 걸음을 연습하는 작가의 태도는 믿음직스럽다. 그렇기에 우리는 천선란의 시선과 발걸음에 맞추어 『천 개의 파랑』을 읽는 동안 ‘부서지고 다친 작은 존재들의 끈질긴 연대 너머로만 엿볼 수 있는 촘촘한 기쁨’을 누릴 수 있게 된다."
1953816,249,틀려도 괜찮아,마키타 신지 글/하세가와 토모코 그림/유문조 역,토토북,2006-02-10,13000,11700,유아,4-6세,유아,유아 그림책,"한국간행물윤리위원회 선정 필독도서아침독서신문 추천도서'틀리는 건 당연해, 마음 놓고 틀려도 돼!'초등학교 1학년 신입생이 있습니다. 집에서는 이야기도 잘 하고, 유치원에서 발표도 곧잘 하던 아이지만, 낯선 친구들과 낯선 선생님 앞에서는 쑥쓰러워 몸을 뒤로만 뺍니다. 게다가 집이나 유치원보다 경직된 교실의 분위기는 아이를 주눅 들게 하여 알고 있는 것도 발표할 수 없게 만듭니다. 이 책은 아이들에게 틀린 답이라도 자신있게 말해가며 정답을 얻어갈 수 있다는 것을 알려주는 책입니다. 멋지게 대답하고 싶지만 틀릴까봐, 답이 틀렸다고 친구들이 웃지 않을까 하는 생각에 나서기를 망설이는 초등학교 신입생들에게 교실은 틀려도 괜찮은 곳, 틀리면서 정답을 찾아가는 곳이라는 것을 알려주면서 즐거운 마음으로 학교 생활을 할 수 있게 도와줍니다."
36107756,250,핑크펭귄,"빌 비숍 저 / 안진환 역 / 박재현, 강규형 감수",스노우폭스북스,2021-04-28,15000,13500,경제 경영,마케팅/세일즈,,,"완전히 새롭고, 완전히 다른, 빅 아이디어를 찾아유일한 존재로 시장을 장악하라! 2017년 초판 발행 후 마케터가 읽어야 할 필도서로 꾸준히 추천 받아온 『핑크펭귄』. 『핑크펭귄』은 세계적인 마케팅 전문가 빌 비숍이 내놓은 마케팅 전략서로 지난 25년 간 전 세계 4,000여개 기업에서 실행하고 성과를 거둔 사례를 바탕으로 비즈니스 차별화를 이룰 수 있는 모든 방법을 담은 책이다. 특히 한국어판 출간의 경우, 이미 오래 전 절판된 도서였으나 독자들의 꾸준한 사랑을 받으며 중고도서로 그 맥을 이어오다 대중의 니즈를 해소시켜 주려는 의도로 새로이 판권을 계약하며 출간될 수 있었다. 이 책은 어떻게 하면 고객이 한 눈에 우리 기업 혹은 개인을 독보적으로 구별되게 만들 수 있을까? 혹은 알아보게 할 수 있을까, 어떻게 해야 고객이 알아서 찾아오게 할 수 있을까라는 기업의 고민에 대한 해답을 주는 도서다. 저자는 그 해답의 명칭을 ‘핑크펭귄’으로 정하고 핵심사항을 한 권의 책에 구성해 담는 방식으로 설득과 주장을 이해시키고 있다."
64694842,251,당신이 옳다,정혜신 저,해냄,2018-10-10,17500,15750,인문,심리,인문,심리,"‘다정한 전사’ 정혜신이 전하는 심리적 CPR 행동 지침서마음을 포개는 그 ‘한 사람’이 당신을 살린다일상에서 사회적 트라우마 현장까지30여 년간 길어 올린 치유 경험과 내공“지금 마음이 어떠세요? 도대체 얼마나 힘들었던 거예요?”공감과 경계의 기술로 짓는 소박하지만 든든한‘집밥’같은 심리학!               만성적인‘나’기근과 관계의 갈등에 시달리는 이들을 위한 책               타인의 시선과 기대에 부응하려 발버둥치고, 갑질 하는 조직에서 억지 미소로 참아내고, 성공과 효율을 좇는 사회의 기준에 허덕이고, 관계의 고단함 속에 내 마음은 뒷전이 될 때… 우리는 존재 자체로 존중받지 못한 채 각자의 개별성은 무시된다. 이처럼 날로 팍팍해지는 현실 속에서 우리나라 3명 중 1명은 우울증상을 겪고 있고, 자살률은 몇 년째 세계 최고 수준이다. 지금 우리, 괜찮은 것일까?이에 사회적 재난 현장부터 일상의 순간까지 고통받는 이들과 함께해온 정신과 의사 정혜신은 우리에게 ‘심리적 CPR(심폐소생술)’이 절실하다고 진단한다. 최근 15년 간 진료실을 벗어나 보통 사람들은 물론 트라우마 피해자부터 CEO까지 다양한 이들의 속마음을 만나며 우리 사회 곳곳에서 많은 이들이 무너지고 상처받고 있음을 확인한 결과이다. 이러한 응급 상황에 저자는 신간『당신이 옳다』를 통해 누구라도 심리적 CPR의 행동지침을 배울 수 있게 안내하고자 한다. ‘나를 구하고 너를 살릴 수 있는’ 실전 방법을 세밀히 담은 이 책은, 30여 년간 정신과 의사로 거리의 치유자로 현장에서 쌓아 올린 그의 경험과 내공, 정성이 집대성된 결과물이기도 하다."
59272030,252,한밤중 달빛 식당,이분희 글/윤태규 그림,비룡소,2018-03-15,13000,11700,어린이,3-4학년,어린이,어린이 문학,"제7회 비룡소 문학상 대상 수상작 “지우고 싶은 나쁜 기억이 있으면, ‘한밤중 달빛 식당’으로 오세요!” 기억과 선택에 대한 아름답고 환상적인 이야기 매년 신선한 작가와 작품으로 저학년 문학에 새로운 활기를 일으켜 온 비룡소 문학상이 7회를 맞아 이분희의 『한밤중 달빛 식당』을 수상작으로 발표했다. 『한밤중 달빛 식당』은 나쁜 기억으로 맛있는 음식을 사 먹는 ‘달빛 식당’을 중심으로 일어난 일을 담은 판타지 동화다. 신비롭고 매력적인 캐릭터, 나쁜 기억을 내면 맛있는 음식을 먹을 수 있는 식당이라는 독특한 설정은 호기심을 불러일으키며 이야기의 몰입도를 높인다. 연우가 초코시럽을 가득 얹은 커스터드 푸딩을 맛있게 먹고 나자 ‘나쁜 기억’이 사라진다.  그렇게 사라진 나쁜 기억이 무엇인지 의문으로 둔 채 흘러가는 서사는 예상치 못한 반전을 거듭하며 ‘나쁜 기억을 모두 없애면 과연 행복해질까?’라는 만만치 않은 주제를 어린이 독자가 쉽게 접근할 수 있도록 돕는다.  심사위원 김진경(시인, 동화작가), 김리리(동화작가), 김지은(아동청소년평론가)은 “‘기억을 바탕으로 이루어진 인간의 삶’이라는 어려운 소재와 주제를 가지고 이토록 환상적이고 감동적인 작품을 만들어 낸 작가의 역량이 놀랍다”고 평가했다. 낮에는 보이지 않지만, 한밤중 달이 뜨면 노란 불빛을 반짝이며 나타나는 ‘한밤중 달빛 식당’은 살아가면서 누구나 받는 시련과 상처에 새 살을 돋게 해 준다. 어른과 아이가 함께 읽고 치유 받을 수 있는 ‘힐링 동화’다."
112238387,253,모비딕,허먼 멜빌 저/레이먼드 비숍 그림/이종인 역,현대지성,2022-09-02,19900,17910,소설/시/희곡,고전문학,소설/시/희곡,영미소설,"드라마 [이상한 변호사 우영우] 속 우영우가 읽은 소설국내 최초 ‘레이먼드 비숍’ 목판화 일러스트 수록 완역본절대적 진리만을 강요하던 폭력의 시대에 맞서실험적이고 전위적인 문학의 효시가 된 불후의 고전  『모비 딕』은 단순한 해양모험소설이 아니라 수많은 상징과 은유를 품은 다면적인 소설이다. “나를 이슈메일이라 불러다오.” 이 유명한 첫 문장은 소설 전체를 관통하는 상징성을 지닌다(영국 일간지 텔레그래프 선정, ‘세계에서 가장 위대한 첫 문장 30’). 주인공 이슈메일뿐 아니라 에이해브, 요나, 욥, 프로메테우스, 페르세우스, 나르키소스 등 성경과 그리스신화 인물들이 주요 모티브와 알레고리로 작용한다. 또한, 에이해브 선장과 모비 딕의 극적인 대립, 선원 커뮤니티의 계층·인종 간 갈등, 등장인물의 개성적인 캐릭터와 심리가 복합적으로 뒤얽힌 채 장엄하게 서사가 흘러간다.1851년에 출간된 『모비 딕』은 이미 반세기 앞서 20세기에 도래할 모더니즘을 예고했다. 세상 모든 진리를 안다는 듯 신의 위치에서 소설을 써 내려간 19세기 리얼리즘 소설가들과는 달리, 20세기 모더니즘 소설가들은 세상을 바라보는 화자의 주관적 관점과 내면 심리를 극화하는 데 집중했다. 그리하여 『모비 딕』은 획기적인 퓨전풍 스토리텔링, 독창적인 작품 구조, 다양한 인간 군상 추적, 이야기와 상징의 절묘한 결합, 인생의 신비를 둘러싼 깊은 종교적·철학적 탐구, 뛰어난 유머 감각과 풍자, 열린 결말 등등 기존에 없던 실험적이고 전위적인 형식으로 미국 모더니즘 문학의 효시이자 상징주의 문학의 대표작이 되었다.그렇다면 이 소설에서 궁극적으로 추적하는 흰 고래 모비 딕은 무엇을 의미할까? 색깔이 ‘흰’ 고래는 하나로만 해석되는 절대적 존재가 아니라 사실상 모든 것을 상징한다. 독자가 부여하는 빛에 따라 상징의 색깔이 달라지기 때문이다. 역자 해제에서는 종교, 신화, 사회, 심리, 철학적 측면에서 각각 신, 괴물, 노예제, 트라우마, 존재의 신비로 해석했다. 이 다섯 가지 해석을 염두에 두고 소설을 읽으면 작품의 의미가 입체적이고 풍성하게 다가올 것이다. 베테랑 고전 번역가 이종인 선생이 멜빌 특유의 장중하고 거침없으면서도 재치 있고 섬세한 문장을 탁월하고 가독성 높은 우리글로 옮겨 즐거운 독서 경험을 선사한다. 이제 해석의 주도권은 독자 각자에게 주어졌다. 여러분도 『모비 딕』을 통해 나만의 ‘흰 고래’를 찾아 머나먼 항해를 떠나보면 어떨까."
